id,eventId,name,description
c7e3d369-60cd-4419-a525-c17c67262022,event-55,Time Management - Workshop Mobile 1990,"Hit friend bit agree hold card almost. Operation company computer evidence camera new then.
Word hear knowledge. Employee movement take goal hospital west suffer."
09f034e4-ebde-46f2-841b-66834d21d64d,event-104,Presentation Skills - Exhibition Data Science 1971,Available he seven. End hit wonder marriage another. Hundred environment but by sing of.
2338d737-0ceb-4af8-8079-571109875663,event-64,Technical Skills - Conference Cloud Computing 197,From author development hair. Project decision available right rule leader seem.
97bdf2c7-36d0-4f37-9257-6d10240d3d68,event-96,Creativity - TechFest Web Dev 1982,Determine middle door report opportunity especially place. Team enjoy information. Win rest new benefit magazine tree.
f25e0b31-2e88-4aaf-a46e-425af3138a65,event-129,Critical Thinking - Seminar Mobile 1992,"Sint nemo velit error dolor reprehenderit consectetur voluptates. Commodi odio ipsa repellat minus nam.
Accusamus nisi aperiam quidem. Fugiat aliquid nulla ducimus."
9db29169-ea98-4836-8385-5f501831fc8a,event-138,Teamwork - TechFest Data Science 1971,Religious position share author but person. Various born charge material positive morning it. Sign window travel around trouble.
2040327d-0a93-45f4-8a8c-68963dfe1219,event-62,Communication - Seminar Mobile 1991,"Keep court result who. Sometimes could research military leave. Family hard ok smile.
Situation seat worker note. Summer coach myself land scientist cause exist."
241f540f-a940-4793-bff9-bc9f00f53a2e,event-78,Technical Skills - TechFest Blockchain 1977,Visit product until somebody keep political note attorney. Test hope charge foreign. Nature send time deep everything responsibility level. Eye whom smile here onto.
c2b104d7-efca-40fa-a31d-6b05da81503e,event-93,Presentation Skills - Competition Mobile 2022,Accusamus possimus sint animi dignissimos. Ipsam beatae fuga fugiat cupiditate assumenda deleniti. Quae aspernatur hic. Ad soluta porro ut.
ab50d53b-a2d7-4bc3-ab1a-55af4c0c9cbf,event-127,Time Management - Workshop Web Dev 1983,"Address improve Congress usually. Left run certain accept.
Her card entire security debate. Live answer heart break cause station. Agree drive trouble mission indeed resource."
0448f9be-fdb4-4724-825b-1989d070ba38,event-22,Technical Skills - Exhibition Web Dev 1991,"Education long step firm never. Matter section student.
Not within energy why. Material especially church turn affect between foreign.
Forward respond thousand. I rest issue mouth.
Focus board level."
9f0a4b19-dda2-4b7d-a51d-5eae7b107771,event-18,Teamwork - Hackathon Blockchain 2007,See truth a woman. Fall remain billion scene enjoy same debate face. Smile capital discussion help small including.
697a41e4-b061-4651-ba8b-815000afa08f,event-101,Teamwork - Hackathon Mobile 1991,Dolorem quidem tempora architecto cumque quod laudantium harum. Et distinctio reiciendis dolores repudiandae provident iste.
48d2d4a8-2f85-4821-a503-dfdd181f4410,event-50,Teamwork - Workshop IoT 1970,"Guy whom white than entire. Board hit drive difficult ago now enter relate.
Expect hair always alone.
Consider bring happen home matter carry give. Officer guess bank fast."
69ef4900-0b49-441d-8b59-00dfdf3cf404,event-146,Critical Thinking - Conference Cloud Computing 197,Word send whole table husband shake start. Politics dog understand wear character know safe. Money student start speech week.
f2163797-2a4e-485a-8139-bd9666ac9375,event-32,Teamwork - Bootcamp Web Dev 1974,"Staff hour bad physical ahead enjoy.
Our big do heavy us drug. Instead physical rule garden cultural Democrat not.
Mention key bank owner choose similar. Style allow base decide impact any."
0a37c464-7510-474a-9ee6-a2bd0556f694,event-100,Technical Skills - Exhibition Blockchain 2020,"Ipsam fuga blanditiis porro quos porro.
Cupiditate reiciendis eos repellat suscipit molestiae porro ex. Dicta eum odio commodi veritatis adipisci."
54470ce7-9a79-4d61-811e-285cf242ad24,event-93,Time Management - Competition Mobile 2022,Atque at ad optio rem est. Tenetur itaque inventore. Error fugiat et maxime. Rem autem occaecati dicta accusamus facilis natus.
218dd895-3a4d-4799-9dda-2f84ca795a24,event-38,Project Management - Seminar Blockchain 2024,"Design season on act. Read attention across cause message doctor their.
Appear center agree. Event market middle increase sea two."
14c87ad1-3959-4bbf-8ba8-7456b4ed55bf,event-13,Creativity - Competition Blockchain 2005,Aperiam alias sed quos minus vitae placeat. Necessitatibus sunt perferendis sint architecto velit. Aut cumque beatae soluta saepe. Expedita pariatur voluptates.
468f5170-8fd4-4fb5-ac67-6db8c1299b43,event-2,Technical Skills - Seminar Mobile 2008,Accusamus fugit soluta hic dolor cumque. Soluta cupiditate excepturi.
0ba2c4a1-7da2-41cd-ae75-45e9200c720e,event-138,Technical Skills - TechFest Data Science 1971,Anything everybody agreement rock short class spring. Near support country mention cell hard. Relationship role chance gun spend upon.
8c1d6984-795d-41db-bd14-6c2bc70af128,event-27,Leadership - Conference Mobile 2007,About cup improve political box another. This until speak never alone skill anything.
0ccffc38-90ea-4cf0-aaa4-7f122345bbf3,event-109,Communication - Seminar Blockchain 2008,"Odio delectus eligendi. Maxime ratione ducimus.
Voluptate cum fugit. Nobis perspiciatis tenetur quas at. Cum tempore quibusdam animi."
c825a79b-1dfd-4640-aa34-a04b7ba7cca5,event-57,Critical Thinking - Competition Cloud Computing 20,"Whether eye on somebody price same nature. Recently other Republican why must federal. Medical claim perform check.
Door necessary anything. Action but skill like."
921d6812-d97f-4c65-b180-5d6766aaa20e,event-39,Leadership - TechFest Blockchain 1977,Operation station sing continue design. Small very news perhaps within. Hand both hope any such professional company.
616a0aad-5083-4815-a3c7-e3b7b98c6cfd,event-144,Leadership - Competition AI 1978,Dolore enim iste vitae dicta delectus modi. Delectus ab quibusdam laboriosam sed dicta deserunt. Accusamus ut veritatis. Quasi placeat voluptates dolore eligendi molestias non numquam.
e64def96-09af-4e52-937b-8c4773584dc5,event-21,Technical Skills - Seminar Cloud Computing 1974,Social information wife check truth grow. Scientist radio your chance decide. She five speech culture.
8362462f-a71b-45c4-9287-9db3b7f479aa,event-37,Presentation Skills - Hackathon Blockchain 1979,Aut dolor omnis fugit ex. Sed doloribus natus quasi et. Vero voluptas deleniti soluta explicabo eligendi quaerat.
5608e30c-0d68-4a1e-ab80-65e6f16999f5,event-138,Project Management - TechFest Data Science 1971,Onto arm as herself not class. Foreign two forget network even. During return cultural hair research again ten.
5ac3d33c-802e-4eaf-8250-86e2b2e38913,event-45,Creativity - Bootcamp Cyber Security 2010,"Outside company economy happy many continue.
Whatever out eight news difference across raise professional. Back wait friend crime."
7d66ac45-1864-49c6-b133-b648e7a6ce4b,event-95,Teamwork - Competition Cyber Security 201,"Consectetur ipsum aspernatur labore vitae quibusdam nam. Fugit occaecati asperiores ad cupiditate illum molestiae. Iusto dolorem voluptates voluptates vero harum.
Minima eaque deserunt."
f6c92359-61d7-4bd1-8dab-3f12c9453905,event-113,Teamwork - Bootcamp Web Dev 1981,Almost it teacher adult method operation. Air fish grow detail training manager partner green. Work particular sister successful film stuff shoulder.
cb21beb0-a0ab-47bd-8ac6-f7de084513f0,event-76,Creativity - Bootcamp Web Dev 2009,Event kitchen trouble table capital culture. Traditional another hope window mission character. Measure article standard than change yet.
701d1982-9f0b-4ce0-8efd-1c3a8d43da3e,event-63,Time Management - Competition Mobile 1986,"Fire all defense. Finally item reflect feel strong.
Line usually fear southern always wonder. Beat suddenly everything gas door. Talk almost can."
c018ebea-b6fa-480e-9c52-2dc7fdf6a175,event-56,Project Management - Seminar Mobile 2018,Temporibus doloremque ipsam enim molestias. Necessitatibus quaerat rerum sequi voluptates. Delectus tempore inventore pariatur. Cumque cum consectetur minima ut nisi.
1c98933e-f24b-4201-af3b-eb6fc74865b1,event-73,Communication - Seminar AI 1996,"Collection stand or whatever heart. Candidate wear study across international hold.
Instead hair they program weight. Much while begin home."
ed682630-9d4f-481a-9310-273f971bd519,event-75,Creativity - Conference Data Science 1974,"Together no line. Window almost director color decision rather catch. Food democratic future professor.
Perhaps wrong study cut early. Likely history technology add. Myself alone lay off ago charge."
2f84201c-6e85-4b7b-889f-70dc50c5e697,event-79,Critical Thinking - Seminar Cyber Security 1996,Growth especially work in. Country pattern bar low need. Follow them per allow.
b5130e8e-3dd2-42e9-a463-1e39c24202fe,event-105,Project Management - Bootcamp Cyber Security 1988,Blanditiis error temporibus doloribus doloribus saepe sint. Necessitatibus mollitia pariatur quaerat.
4be414c6-d1f7-450e-9798-780c405bc3e2,event-120,Time Management - Exhibition Data Science 2023,Repellendus provident perspiciatis soluta voluptatibus. Fugiat deleniti voluptatum quasi aut voluptate praesentium amet. Veritatis aspernatur qui nobis perferendis saepe.
24dc45c1-5182-4eac-94d7-d3780c69cffc,event-36,Time Management - TechFest AI 1979,Crime should policy free participant party. Pull pull concern. Young these civil peace president head. Guy administration bit born.
f4284df4-c8cc-4ea0-8c29-084a538ae0fb,event-60,Communication - Workshop Cyber Security 2023,"Voluptates rem ex soluta unde error. Ex libero libero modi adipisci nam.
Repudiandae quasi minima quasi nam sed. Numquam ad aut sed deleniti consectetur necessitatibus."
1c4e1703-0305-469e-a47c-914da3b813dc,event-94,Project Management - Hackathon Web Dev 2003,"Modi fugit harum veniam porro architecto. Quidem asperiores aspernatur pariatur vel.
Sequi officia corrupti. Reprehenderit est labore nisi."
645093af-f1d6-4bb9-8517-c854728749d1,event-82,Communication - Workshop IoT 2011,"Perspiciatis vel quia pariatur vitae aspernatur. Ratione nisi consequuntur libero.
Cum ab laboriosam blanditiis dicta pariatur ut perferendis. Eum et aut corporis esse ipsa dolorem."
7110532a-340f-4967-9275-9d131ba1a362,event-44,Teamwork - Bootcamp Data Science 2008,Aut iste veniam ducimus neque nobis incidunt. Veritatis eveniet voluptatum aut ad maiores. Odit minus soluta sed.
7b5852f3-2e01-4b0e-9606-9907c7b9311d,event-25,Teamwork - TechFest Data Science 2021,Consequatur cum incidunt. Delectus dignissimos eum ut animi commodi. Libero libero illum repudiandae expedita voluptatum.
374c6e13-f41e-43ff-a6dd-e4f30bbc72b9,event-24,Technical Skills - Hackathon IoT 2000,Tempora cumque neque eos eum maxime. Aut similique autem perferendis quasi eligendi.
0410f2fd-de66-4b92-8c92-129e5aa66ce6,event-70,Presentation Skills - TechFest Cyber Security 2009,Aliquam voluptatibus occaecati atque. Ipsa veritatis quod dolor. Amet veniam in error facilis accusamus perferendis.
b65c0c40-53b0-4570-85a1-84643989fb81,event-134,Technical Skills - Bootcamp Data Science 1976,Fear over nation call. Among view physical green. Film prevent assume laugh wait between. Push consider federal return foot begin cut.
0fc7930e-295c-4152-887b-87d93c2ad2c8,event-109,Project Management - Seminar Blockchain 2008,"Thousand mention protect early car according receive. Management activity way seek.
Toward should what herself base. Shake entire specific few. Entire the lawyer find."
ff8d9fb0-442d-49c6-9693-32c69e60915b,event-129,Presentation Skills - Seminar Mobile 1992,Tempora nam laboriosam error. Facilis eaque tenetur dolorem vero occaecati magni provident. Omnis repellendus laborum mollitia.
624e5cc4-1244-406a-a264-9d2096d25b94,event-75,Leadership - Conference Data Science 1974,Official letter think every. Impact best ten fine leader production modern. Town certain former subject.
b5a3a7b3-73c2-452e-a6a3-c2aec5be1a00,event-34,Project Management - Hackathon Cloud Computing 1984,"Grow pass care however someone white. I modern mission themselves. Particularly hit because notice see.
Write once us account go stock. Moment best far."
7380d0bc-5653-4aa6-8d09-59f820104892,event-102,Leadership - Conference IoT 2019,Incidunt maxime nam unde. Id error esse laudantium ipsa tenetur. Et quis unde consectetur ipsa sunt dignissimos suscipit.
6fd47b9d-9cb1-4a34-aae6-f20e4ca9a89f,event-136,Leadership - Bootcamp Data Science 2007,"Modi perferendis nesciunt hic dolores eligendi alias. Provident delectus quis consectetur illo suscipit.
Officiis necessitatibus eveniet quaerat alias quasi."
caa2096d-3924-4b45-95be-f94cace89cf5,event-87,Communication - Conference AI 1992,"Tax when ten campaign item catch language behavior.
Recognize bank compare minute. Ago everything lay really."
be5cbf44-f801-4794-967a-58e94ce83f76,event-49,Project Management - Exhibition Cyber Security 2023,"Attack agreement yes war American out reality. Child upon whole owner. In structure be professional.
State speech subject discuss. Realize interesting security house chance glass."
acda97ab-a811-4b53-a85a-fa1f095b3f0b,event-84,Creativity - Competition Blockchain 1982,"Indeed manage staff strategy husband film mean.
Move but bag environment. Attorney professional open exactly yet sister for attention.
Consider day light. Imagine company adult region so he."
e4844b51-9d89-41aa-a5a5-4f6b03430a28,event-108,Communication - Bootcamp Blockchain 1990,Why challenge after understand positive study machine. That week him difficult white. General parent start would girl meeting morning each.
